{
  "id": "project-ppt",
  "name": "项目汇报 PPT",
  "category": "ppt",
  "description": "根据项目概况和阶段成果，自动生成 8~12 页汇报演示文稿",
  "agent": "ppt_master",
  "version": "1",
  "prompt": "请为以下项目生成汇报 PPT：\n\n项目名称：{{项目名称}}\n汇报对象：{{汇报对象}}\n汇报时间：{{汇报日期}}\n项目阶段：{{项目阶段}}\n核心亮点：{{核心亮点}}\n附件数据：{{附件目录}}\n\n幻灯片结构建议：\n1. 封面（项目名 + 汇报人 + 日期）\n2. 项目概况（地点、规模、工期）\n3. 工作进度（甘特图或进度条）\n4. 技术路线\n5. 阶段成果展示（含图片/图纸截图）\n6. 数据分析摘要（调用 rw_trend_analysis 输出图表）\n7. 质量管控措施\n8. 下阶段计划\n9. 风险与对策\n10. 结束页\n\n风格：专业简洁，使用暖棕 rgb(95,70,24) 作为强调色，字体微软雅黑，输出 .pptx 文件。",
  "variables": [
    {
      "key": "项目名称",
      "label": "项目名称",
      "type": "text",
      "placeholder": "如：佛山禅城区地下管线普查"
    },
    {
      "key": "汇报对象",
      "label": "汇报对象",
      "type": "text",
      "placeholder": "如：业主方项目部"
    },
    {
      "key": "汇报日期",
      "label": "汇报日期",
      "type": "date"
    },
    {
      "key": "项目阶段",
      "label": "项目阶段",
      "type": "select",
      "options": ["前期踏勘", "外业采集", "内业处理", "成果提交", "验收阶段"]
    },
    {
      "key": "核心亮点",
      "label": "核心亮点",
      "type": "text",
      "placeholder": "如：首次引入无人机倾斜摄影，效率提升 40%"
    },
    {
      "key": "附件目录",
      "label": "附件目录",
      "type": "text",
      "placeholder": "如：/data/results/2026-05/",
      "required": false
    }
  ]
}
