{
  "id": "compliance-review",
  "name": "规范合规性审查",
  "category": "report",
  "description": "将成果报告与指定国家/行业标准逐条比对，标注不符合项",
  "agent": "qa_reviewer",
  "version": "1",
  "prompt": "请对以下成果文件进行规范合规性审查：\n\n成果文件：{{成果文件路径}}\n适用规范：{{适用规范列表}}\n工程类别：{{工程类别}}\n审查深度：{{审查深度}}\n\n审查要求：\n1. 逐章节对照规范强制性条文\n2. 调用 rw_compliance 工具执行自动化条文检索\n3. 将不符合项列为表格（条款编号 | 问题描述 | 严重等级 | 整改建议）\n4. 严重等级分为：致命（必须整改）、严重（建议整改）、一般（可优化）\n5. 输出审查报告（Word），审查结论须给出“通过 / 有条件通过 / 不通过”。",
  "variables": [
    {
      "key": "成果文件路径",
      "label": "成果文件路径",
      "type": "text",
      "placeholder": "如：/reports/竣工测量报告_v2.docx"
    },
    {
      "key": "适用规范列表",
      "label": "适用规范（逗号分隔）",
      "type": "text",
      "placeholder": "如：GB 50026-2020,CJJ/T 73-2019"
    },
    {
      "key": "工程类别",
      "label": "工程类别",
      "type": "select",
      "options": ["市政测量", "地铁监测", "管线普查", "地形图测绘", "竣工测量", "变形监测"]
    },
    {
      "key": "审查深度",
      "label": "审查深度",
      "type": "select",
      "options": ["快速扫描（主要章节）", "标准审查（全文）", "深度审查（含附录及图表）"]
    }
  ]
}
