{
  "id": "review-response",
  "name": "内审/专家评审回复表",
  "category": "report",
  "description": "逐条闭合审查意见，生成修改位置、修改后内容和依据",
  "agent": "qa_reviewer",
  "version": "1",
  "prompt": "请根据{{意见来源}}对{{项目名称}}的审查意见生成逐条回复表。意见内容：{{意见内容}}。要求输出“意见原文 | 是否采纳 | 修改位置 | 修改后内容 | 依据 | 状态”，未采纳意见必须说明原因和替代措施。",
  "variables": [
    {
      "key": "项目名称",
      "label": "项目名称",
      "type": "text"
    },
    {
      "key": "意见来源",
      "label": "意见来源",
      "type": "select",
      "options": ["内部评审", "专家评审", "运营单位", "设计院", "甲方"]
    },
    {
      "key": "意见内容",
      "label": "意见内容",
      "type": "text",
      "placeholder": "粘贴审查意见或填写意见文件路径"
    }
  ]
}
